<?xml version="1.0" encoding="UTF-8"?>
<xs:schema targetNamespace = "localfile" xmlns = "localfile" elementFormDefault="qualified" xmlns:xs="http://www.w3.org/2001/XMLSchema">
  <xs:element name="team">
    <xs:complexType>
      <xs:sequence>
        <xs:element name="row" maxOccurs="unbounded" minOccurs="0">
          <xs:complexType>
            <xs:sequence>
              <xs:element type="xs:short" name="id"/>
              <xs:element type="xs:string" name="name"/>
              <xs:element type="xs:byte" name="student_id"/>
            </xs:sequence>
          </xs:complexType>
        </xs:element>
      </xs:sequence>
    </xs:complexType>
  </xs:element>
</xs:schema>