<?xml version="1.0" encoding="UTF-8"?>
<team xmlns="localfile" xmlns:xsi="http://www.w3.org/2001/XMLSchema-instance" xsi:schemaLocation = "localfile team_details.xsd">
<row>
   <id>210</id>
   <name>Igniters</name>
   <student_id>1</student_id>
</row>
<row>
   <id>212</id>
   <name>Shilesh</name>
   <student_id>5</student_id>
</row>
<row>
   <id>214</id>
   <name>Tritons</name>
   <student_id>5</student_id>
</row>
<row>
   <id>216</id>
   <name>Gayu</name>
   <student_id>1</student_id>
</row>
<row>
   <id>218</id>
   <name>Rangers</name>
   <student_id>4</student_id>
</row>

</team>